{
  "dashboard_schema_version": 1,
  "entries": [
    {
      "artifact_count": 18,
      "compatibility": {
        "benchmark_packs": [],
        "environments": [
          {
            "bridge_version": "0.4.0",
            "codex_command": [
              "/Applications/ChatGPT.app/Contents/Resources/codex"
            ],
            "model": "gpt-5.6-sol",
            "platform": "Darwin 25.5.0 (arm64)",
            "python_version": "3.14.6",
            "sandbox": "workspace-write",
            "sigmap_command": [
              "sigmap"
            ]
          }
        ],
        "task_ids": [
          "artifact-run-status",
          "markdown-comparisons",
          "report-failure-exit"
        ]
      },
      "compatibility_key": "f22c2a006c0ade52306e0c91e0d9865dab75924ac869fba0fef76d1cd8ca81be",
      "complete_pair_count": 9,
      "excluded_incomplete_attempt_count": 0,
      "failure_count": 0,
      "report": {
        "artifact_count": 18,
        "comparisons": {
          "sigmap_to_raw_median_input_tokens_ratio": 0.733633557631846,
          "sigmap_to_raw_median_runtime_ratio": 0.749090287129336,
          "sigmap_to_raw_success_rate_ratio": 1.0
        },
        "environments": [
          {
            "bridge_version": "0.4.0",
            "codex_command": [
              "/Applications/ChatGPT.app/Contents/Resources/codex"
            ],
            "model": "gpt-5.6-sol",
            "platform": "Darwin 25.5.0 (arm64)",
            "python_version": "3.14.6",
            "sandbox": "workspace-write",
            "sigmap_command": [
              "sigmap"
            ]
          }
        ],
        "exact_commands": [
          [
            "/opt/homebrew/opt/python@3.14/bin/python3.14",
            "-m",
            "sigmap_codex_bridge",
            "benchmark",
            "run",
            "benchmarks/tasks/artifact-run-status.yaml",
            "benchmarks/tasks/markdown-comparisons.yaml",
            "benchmarks/tasks/report-failure-exit.yaml",
            "--experiment-id",
            "build-week-2026-07-18",
            "--output-dir",
            "benchmark_runs/build-week-2026-07-18",
            "--model",
            "gpt-5.6-sol",
            "--codex-command",
            "/Applications/ChatGPT.app/Contents/Resources/codex",
            "--context-timeout",
            "120",
            "--sandbox",
            "workspace-write",
            "--json"
          ]
        ],
        "experiment_ids": [
          "build-week-2026-07-18"
        ],
        "failures": [],
        "overall": {
          "raw": {
            "attempts": 9,
            "failed": 0,
            "medians": {
              "cached_input_tokens": 692992.0,
              "command_events": 20.0,
              "input_tokens": 766538.0,
              "output_tokens": 7169.0,
              "patch_lines": 58.0,
              "runtime_seconds": 249.088759,
              "tool_events": 0.0
            },
            "passed": 9,
            "success_rate": 1.0
          },
          "sigmap": {
            "attempts": 9,
            "failed": 0,
            "medians": {
              "cached_input_tokens": 521216.0,
              "command_events": 15.0,
              "input_tokens": 562358.0,
              "output_tokens": 4587.0,
              "patch_lines": 56.0,
              "runtime_seconds": 186.58997,
              "tool_events": 0.0
            },
            "passed": 9,
            "success_rate": 1.0
          }
        },
        "paired_analysis": {
          "complete_pair_count": 9,
          "correctness_transitions": {
            "both_failed": 0,
            "both_passed": 9,
            "raw_only_passed": 0,
            "sigmap_only_passed": 0
          },
          "excluded_incomplete_attempt_count": 0,
          "incomplete_pairs": [],
          "metrics": {
            "input_tokens": {
              "comparable_pairs": 9,
              "confidence_interval": {
                "observed_pairs": 9,
                "reason": "paired confidence intervals require at least 10 values",
                "required_pairs": 10,
                "status": "insufficient_evidence"
              },
              "direction_counts": {
                "improved": 6,
                "regressed": 3,
                "unavailable": 0,
                "unchanged": 0
              },
              "effect": {
                "median_absolute_deviation": 233004.0,
                "median_delta": -195198.0,
                "median_relative_delta": -0.24354602655327687
              },
              "pairs": [
                {
                  "delta": 57024.0,
                  "direction": "regressed",
                  "experiment_id": "build-week-2026-07-18",
                  "pair_id": "artifact-run-status-r001",
                  "raw": 534456.0,
                  "relative_delta": 0.10669540617001212,
                  "repetition": 1,
                  "sigmap": 591480.0,
                  "task_id": "artifact-run-status"
                },
                {
                  "delta": -195198.0,
                  "direction": "improved",
                  "experiment_id": "build-week-2026-07-18",
                  "pair_id": "artifact-run-status-r002",
                  "raw": 801483.0,
                  "relative_delta": -0.24354602655327687,
                  "repetition": 2,
                  "sigmap": 606285.0,
                  "task_id": "artifact-run-status"
                },
                {
                  "delta": 134154.0,
                  "direction": "regressed",
                  "experiment_id": "build-week-2026-07-18",
                  "pair_id": "artifact-run-status-r003",
                  "raw": 487327.0,
                  "relative_delta": 0.27528538332577507,
                  "repetition": 3,
                  "sigmap": 621481.0,
                  "task_id": "artifact-run-status"
                },
                {
                  "delta": -425249.0,
                  "direction": "improved",
                  "experiment_id": "build-week-2026-07-18",
                  "pair_id": "markdown-comparisons-r001",
                  "raw": 766538.0,
                  "relative_delta": -0.5547657128544182,
                  "repetition": 1,
                  "sigmap": 341289.0,
                  "task_id": "markdown-comparisons"
                },
                {
                  "delta": -369775.0,
                  "direction": "improved",
                  "experiment_id": "build-week-2026-07-18",
                  "pair_id": "markdown-comparisons-r002",
                  "raw": 772515.0,
                  "relative_delta": -0.47866384471498935,
                  "repetition": 2,
                  "sigmap": 402740.0,
                  "task_id": "markdown-comparisons"
                },
                {
                  "delta": 301605.0,
                  "direction": "regressed",
                  "experiment_id": "build-week-2026-07-18",
                  "pair_id": "markdown-comparisons-r003",
                  "raw": 633998.0,
                  "relative_delta": 0.47571916630651834,
                  "repetition": 3,
                  "sigmap": 935603.0,
                  "task_id": "markdown-comparisons"
                },
                {
                  "delta": -573846.0,
                  "direction": "improved",
                  "experiment_id": "build-week-2026-07-18",
                  "pair_id": "report-failure-exit-r001",
                  "raw": 948009.0,
                  "relative_delta": -0.6053170381293849,
                  "repetition": 1,
                  "sigmap": 374163.0,
                  "task_id": "report-failure-exit"
                },
                {
                  "delta": -428202.0,
                  "direction": "improved",
                  "experiment_id": "build-week-2026-07-18",
                  "pair_id": "report-failure-exit-r002",
                  "raw": 937367.0,
                  "relative_delta": -0.45681360662365966,
                  "repetition": 2,
                  "sigmap": 509165.0,
                  "task_id": "report-failure-exit"
                },
                {
                  "delta": -60679.0,
                  "direction": "improved",
                  "experiment_id": "build-week-2026-07-18",
                  "pair_id": "report-failure-exit-r003",
                  "raw": 623037.0,
                  "relative_delta": -0.09739228970350075,
                  "repetition": 3,
                  "sigmap": 562358.0,
                  "task_id": "report-failure-exit"
                }
              ]
            },
            "output_tokens": {
              "comparable_pairs": 9,
              "confidence_interval": {
                "observed_pairs": 9,
                "reason": "paired confidence intervals require at least 10 values",
                "required_pairs": 10,
                "status": "insufficient_evidence"
              },
              "direction_counts": {
                "improved": 7,
                "regressed": 2,
                "unavailable": 0,
                "unchanged": 0
              },
              "effect": {
                "median_absolute_deviation": 1915.0,
                "median_delta": -1615.0,
                "median_relative_delta": -0.23571535133522303
              },
              "pairs": [
                {
                  "delta": -1580.0,
                  "direction": "improved",
                  "experiment_id": "build-week-2026-07-18",
                  "pair_id": "artifact-run-status-r001",
                  "raw": 6703.0,
                  "relative_delta": -0.23571535133522303,
                  "repetition": 1,
                  "sigmap": 5123.0,
                  "task_id": "artifact-run-status"
                },
                {
                  "delta": -1615.0,
                  "direction": "improved",